[
  {
    "id": "OCG-097",
    "family": "09_feeder_replay",
    "family_name": "External Theory Feeder and Replay",
    "family_scope": "Gemini, Sonar, or other external theory suggestions",
    "replay_signature": "untrusted theory seeds compiled into deterministic Oracle blades",
    "title": "Theory claim atomizer",
    "question": "Can free-form theory be decomposed into checkable atoms?",
    "deterministic_attack": "Parse every statement into assumptions, transformations, conclusions, proof obligations, and dependencies; reject unscoped prose claims.",
    "success_condition": "A typed dependency DAG with no claim bypass.",
    "hard_fail_condition": "Narrative text reaches runtime or publication without an obligation.",
    "theorem_prize": "theory compiler infrastructure",
    "operators": [
      "parse",
      "atomize",
      "dag_validate"
    ],
    "priority": "P0",
    "cost": "medium",
    "dependencies": [
      "frozen_tuple_semantics",
      "verifier_backed_findings",
      "independent_constraint_generator",
      "standalone_certificate_checker"
    ],
    "required_outputs": [
      "claim.json",
      "witness_or_counterexample.json",
      "certificate_or_proof/",
      "run_manifest.json",
      "attack_report.md",
      "failure_boundary.json"
    ],
    "promotion_rule": "No theorem credit without independently checked quantified claims. No transfer credit unless the blade, parameter rule, and second-target selector were sealed before the second execution.",
    "gold_score": 12,
    "launch_rank": 1
  },
  {
    "id": "OCG-098",
    "family": "09_feeder_replay",
    "family_name": "External Theory Feeder and Replay",
    "family_scope": "Gemini, Sonar, or other external theory suggestions",
    "replay_signature": "untrusted theory seeds compiled into deterministic Oracle blades",
    "title": "Analogy/equivalence hard gate",
    "question": "Is each conceptual link identity, implication, analogy, or metaphor?",
    "deterministic_attack": "Force a relation type and generate counterexample probes for every stronger interpretation.",
    "success_condition": "No analogy is promoted as equivalence.",
    "hard_fail_condition": "Ambiguous language such as ‘corresponds’ survives.",
    "theorem_prize": "epistemic safety gate",
    "operators": [
      "relation_type",
      "counterexample_probe",
      "gate"
    ],
    "priority": "P0",
    "cost": "low",
    "dependencies": [
      "frozen_tuple_semantics",
      "verifier_backed_findings",
      "independent_constraint_generator",
      "standalone_certificate_checker"
    ],
    "required_outputs": [
      "claim.json",
      "witness_or_counterexample.json",
      "certificate_or_proof/",
      "run_manifest.json",
      "attack_report.md",
      "failure_boundary.json"
    ],
    "promotion_rule": "No theorem credit without independently checked quantified claims. No transfer credit unless the blade, parameter rule, and second-target selector were sealed before the second execution.",
    "gold_score": 12,
    "launch_rank": 2
  },
  {
    "id": "OCG-099",
    "family": "09_feeder_replay",
    "family_name": "External Theory Feeder and Replay",
    "family_scope": "Gemini, Sonar, or other external theory suggestions",
    "replay_signature": "untrusted theory seeds compiled into deterministic Oracle blades",
    "title": "Source metadata hard gate",
    "question": "Can every literature claim be audited?",
    "deterministic_attack": "Require URL/DOI, theorem or page location, exact hypothesis summary, retrieval time, and content hash.",
    "success_condition": "Untraceable citations are automatically downgraded to leads.",
    "hard_fail_condition": "Numbered citations without metadata are accepted.",
    "theorem_prize": "novelty integrity gate",
    "operators": [
      "source_fetch",
      "metadata_check",
      "hash"
    ],
    "priority": "P0",
    "cost": "medium",
    "dependencies": [
      "frozen_tuple_semantics",
      "verifier_backed_findings",
      "independent_constraint_generator",
      "standalone_certificate_checker"
    ],
    "required_outputs": [
      "claim.json",
      "witness_or_counterexample.json",
      "certificate_or_proof/",
      "run_manifest.json",
      "attack_report.md",
      "failure_boundary.json"
    ],
    "promotion_rule": "No theorem credit without independently checked quantified claims. No transfer credit unless the blade, parameter rule, and second-target selector were sealed before the second execution.",
    "gold_score": 12,
    "launch_rank": 3
  },
  {
    "id": "OCG-100",
    "family": "09_feeder_replay",
    "family_name": "External Theory Feeder and Replay",
    "family_scope": "Gemini, Sonar, or other external theory suggestions",
    "replay_signature": "untrusted theory seeds compiled into deterministic Oracle blades",
    "title": "Mechanism compiler",
    "question": "Can a feeder idea become a pure deterministic operator DAG?",
    "deterministic_attack": "Map every proposed step to a versioned operator; reject unsupported reasoning; derive all parameters from target features.",
    "success_condition": "A runnable blade with no external AI call at execution time.",
    "hard_fail_condition": "Natural-language reasoning remains in runtime.",
    "theorem_prize": "attack-compounding infrastructure",
    "operators": [
      "operator_map",
      "dag_emit",
      "parameter_rule",
      "runtime_audit"
    ],
    "priority": "P0",
    "cost": "high",
    "dependencies": [
      "frozen_tuple_semantics",
      "verifier_backed_findings",
      "independent_constraint_generator",
      "standalone_certificate_checker"
    ],
    "required_outputs": [
      "claim.json",
      "witness_or_counterexample.json",
      "certificate_or_proof/",
      "run_manifest.json",
      "attack_report.md",
      "failure_boundary.json"
    ],
    "promotion_rule": "No theorem credit without independently checked quantified claims. No transfer credit unless the blade, parameter rule, and second-target selector were sealed before the second execution.",
    "gold_score": 15,
    "launch_rank": 4
  },
  {
    "id": "OCG-101",
    "family": "09_feeder_replay",
    "family_name": "External Theory Feeder and Replay",
    "family_scope": "Gemini, Sonar, or other external theory suggestions",
    "replay_signature": "untrusted theory seeds compiled into deterministic Oracle blades",
    "title": "Assumption proving router",
    "question": "Which feeder assumptions are proved, finitely checked, false, or unresolved?",
    "deterministic_attack": "Route atoms to symbolic, exhaustive, SAT/ILP, formal, or primary-source checkers while preserving four-valued status.",
    "success_condition": "Every assumption has evidence and status.",
    "hard_fail_condition": "Finite checking is promoted to an unrestricted proof.",
    "theorem_prize": "epistemic contract",
    "operators": [
      "route",
      "prove",
      "check",
      "refute"
    ],
    "priority": "P0",
    "cost": "high",
    "dependencies": [
      "frozen_tuple_semantics",
      "verifier_backed_findings",
      "independent_constraint_generator",
      "standalone_certificate_checker"
    ],
    "required_outputs": [
      "claim.json",
      "witness_or_counterexample.json",
      "certificate_or_proof/",
      "run_manifest.json",
      "attack_report.md",
      "failure_boundary.json"
    ],
    "promotion_rule": "No theorem credit without independently checked quantified claims. No transfer credit unless the blade, parameter rule, and second-target selector were sealed before the second execution.",
    "gold_score": 11,
    "launch_rank": 5
  },
  {
    "id": "OCG-102",
    "family": "09_feeder_replay",
    "family_name": "External Theory Feeder and Replay",
    "family_scope": "Gemini, Sonar, or other external theory suggestions",
    "replay_signature": "untrusted theory seeds compiled into deterministic Oracle blades",
    "title": "Micro-instance gauntlet",
    "question": "Does the compiled blade behave correctly on known cases?",
    "deterministic_attack": "Generate positive, negative, boundary, degenerate, and semantics-variant microinstances and compare to exact truth.",
    "success_condition": "Perfect expected behavior or rejection before scaling.",
    "hard_fail_condition": "Only positive examples are tested.",
    "theorem_prize": "validation gate",
    "operators": [
      "microgen",
      "exact_oracle",
      "differential_test"
    ],
    "priority": "P0",
    "cost": "medium",
    "dependencies": [
      "frozen_tuple_semantics",
      "verifier_backed_findings",
      "independent_constraint_generator",
      "standalone_certificate_checker"
    ],
    "required_outputs": [
      "claim.json",
      "witness_or_counterexample.json",
      "certificate_or_proof/",
      "run_manifest.json",
      "attack_report.md",
      "failure_boundary.json"
    ],
    "promotion_rule": "No theorem credit without independently checked quantified claims. No transfer credit unless the blade, parameter rule, and second-target selector were sealed before the second execution.",
    "gold_score": 12,
    "launch_rank": 6
  },
  {
    "id": "OCG-103",
    "family": "09_feeder_replay",
    "family_name": "External Theory Feeder and Replay",
    "family_scope": "Gemini, Sonar, or other external theory suggestions",
    "replay_signature": "untrusted theory seeds compiled into deterministic Oracle blades",
    "title": "Causal ablation",
    "question": "Which part of the feeder theory creates the gain?",
    "deterministic_attack": "Remove each assumption and operator; rerun identical targets and budgets; compare theorem status and proof size.",
    "success_condition": "A minimal causal blade or evidence the feed added nothing.",
    "hard_fail_condition": "Technique count earns credit without measured necessity.",
    "theorem_prize": "mechanism validation",
    "operators": [
      "ablate",